{"schema_version":"1.0.0","experiment_id":"size_reroute_synthetic","provider":"dflow","endpoint_type":"developer","mode":"fixture","pair":"USDC/SOL","input_amount":"1000000000","fixed_parameters":{"slippage_bps":50},"treatment_variable":"input_amount","treatment_values":["100000000","1000000000","10000000000"],"baseline_value":"1000000000","maximum_request_count":3,"output_path":"artifacts/experiments/size_reroute_synthetic","fixture_dir":"tests/fixtures/experiments/size_reroute","endpoint_hostname":"dev-quote-api.dflow.net","notes":"Synthetic size ladder with an intentional route-label change at the largest size. Not a market-share claim."}
