{"schema_version":"1.0.0","experiment_id":"fee_injection_synthetic","provider":"dflow","endpoint_type":"developer","mode":"fixture","pair":"USDC/SOL","input_amount":"1000000000","fixed_parameters":{"slippage_bps":50},"treatment_variable":"platform_fee_bps","treatment_values":[0,2,10],"baseline_value":0,"maximum_request_count":3,"output_path":"artifacts/experiments/fee_injection_synthetic","fixture_dir":"tests/fixtures/experiments/fee_injection","endpoint_hostname":"dev-quote-api.dflow.net","notes":"Synthetic DFlow-dev-shaped quotes. Controlled experiment on platformFee visibility; not realized fee capture."}
