{"schema_version":"1.0.0","experiment_id":"slippage_encoding_synthetic","provider":"dflow","endpoint_type":"developer","mode":"fixture","pair":"USDC/SOL","input_amount":"1000000000","fixed_parameters":{},"treatment_variable":"slippage_bps","treatment_values":[10,50,100],"baseline_value":50,"maximum_request_count":3,"output_path":"artifacts/experiments/slippage_encoding_synthetic","fixture_dir":"tests/fixtures/experiments/slippage_encoding","endpoint_hostname":"dev-quote-api.dflow.net","notes":"Synthetic quotes: otherAmountThreshold scales with slippageBps. Observational only; no fill simulation."}
